{
  "schema_version": "1.0.0",
  "record_type": "curriculum",
  "record_kind": "example",
  "scope": {
    "primary": [
      "Java language",
      "Java standard library",
      "JVM"
    ],
    "framework_use": "context_only",
    "version_policy": "shared_mechanisms_with_differences"
  },
  "topics": [
    {
      "topic_id": "counter-state",
      "title": "Counter state",
      "prerequisite_ids": [],
      "selection": "accepted",
      "reason": "Fictional topic for the linked examples."
    }
  ]
}
