{
  "schema_version": "1.0.0",
  "record_type": "curriculum",
  "record_kind": "live",
  "scope": {
    "primary": [
      "Java language",
      "Java standard library",
      "JVM"
    ],
    "framework_use": "context_only",
    "version_policy": "shared_mechanisms_with_differences"
  },
  "topics": [
    {
      "topic_id": "jvm",
      "title": "JVM class initialization and class loading",
      "prerequisite_ids": [],
      "selection": "deferred",
      "reason": "The learner deferred further class loader work after the first diagnostic session."
    },
    {
      "topic_id": "exceptions",
      "title": "Java exceptions and resource handling",
      "prerequisite_ids": [],
      "selection": "accepted",
      "reason": "The learner selected exceptions after deferring further class loader work."
    }
  ]
}
